id,companyId,category,month,fileName,fileUrl,fileKey,fileSize,mimeType,uploadStatus,recordsProcessed,errorMessage,uploadedBy,createdAt,updatedAt
120001,60002,espelho_adiantamento_analitico,2026-01,ADIANTAMENTO JANEIRO ANALITICO.pdf,https://d2xsxph8kpxj0f.cloudfront.net/310419663028720190/W4MM458SKqYRWRGGQrfw8A/folha/60002/2026-01/vale-jshj0zrj-ADIANTAMENTO JANEIRO ANALITICO.pdf,folha/60002/2026-01/vale-jshj0zrj-ADIANTAMENTO JANEIRO ANALITICO.pdf,114404,application/pdf,processado,149,,,2026-02-23 20:02:17,2026-02-23 20:02:17
120002,60002,adiantamento_sintetico,2026-01,RELATORIO DE CHEQUES JANEIRO FOLHA.pdf,https://d2xsxph8kpxj0f.cloudfront.net/310419663028720190/W4MM458SKqYRWRGGQrfw8A/folha/60002/2026-01/vale-wcww0xlm-RELATORIO DE CHEQUES JANEIRO FOLHA.pdf,folha/60002/2026-01/vale-wcww0xlm-RELATORIO DE CHEQUES JANEIRO FOLHA.pdf,191323,application/pdf,processado,0,,,2026-02-23 20:02:17,2026-02-23 20:02:17
120003,60002,espelho_adiantamento_analitico,2026-01,ADIANTAMENTO JANEIRO ANALITICO.pdf,https://d2xsxph8kpxj0f.cloudfront.net/310419663028720190/W4MM458SKqYRWRGGQrfw8A/folha/60002/2026-01/vale-l1kacndk-ADIANTAMENTO JANEIRO ANALITICO.pdf,folha/60002/2026-01/vale-l1kacndk-ADIANTAMENTO JANEIRO ANALITICO.pdf,114404,application/pdf,processado,149,,,2026-02-23 20:02:50,2026-02-23 20:02:50
120004,60002,espelho_folha_analitico,2026-01,FOLHA ANALITICA FC JANEIRO.pdf,https://d2xsxph8kpxj0f.cloudfront.net/310419663028720190/W4MM458SKqYRWRGGQrfw8A/folha/60002/2026-01/pagamento-a5s5x60y-FOLHA ANALITICA FC JANEIRO.pdf,folha/60002/2026-01/pagamento-a5s5x60y-FOLHA ANALITICA FC JANEIRO.pdf,1044934,application/pdf,processado,143,,,2026-02-23 20:10:09,2026-02-23 20:10:09
120005,60002,espelho_adiantamento_analitico,2026-01,FOLHA ANALITICA FC JANEIRO.pdf,https://d2xsxph8kpxj0f.cloudfront.net/310419663028720190/W4MM458SKqYRWRGGQrfw8A/folha/60002/2026-01/vale-wluh85ka-FOLHA ANALITICA FC JANEIRO.pdf,folha/60002/2026-01/vale-wluh85ka-FOLHA ANALITICA FC JANEIRO.pdf,1044934,application/pdf,processado,143,,,2026-02-23 21:00:20,2026-02-23 21:00:20
